ID,Year,Title,Description,Inventor,Location,Dependencies,Field,Type,URL,pg#
biped,4000000 BCE,Bipedal species,"Free hands allowed hominids to manipulate objects, bring them closer to our senses and thus increase brain capacity, priming the feedback loop.",,,,General,Discovery,https://en.wikipedia.org/wiki/Bipedalism#Evolution_of_human_bipedalism,
stone-tool,2000000 BCE,Stone tools,"Crows are known for tool use, and chimps can fashion tools out of sticks. Humans learned to sharpen stones into edges and points.",,,biped,General,Invention,https://en.wikipedia.org/wiki/Stone_tool,
fire,500000 BCE,Fire tamed,"Initially, fire had to be found (eg. lightning strikes). Eventually, it became possible to start via friction caused by spinning sticks.",,,stone-tool,General,Invention,https://en.wikipedia.org/wiki/Control_of_fire_by_early_humans,
ceremonial-burial,200000 BCE,Ceremonial burial,Neanderthals were the first hominids to bury their dead rather than leaving their bodies to scavengers and rot. Food and floweres were often buried with the corpse.,,,,Culture,Social,https://en.wikipedia.org/wiki/Prehistoric_religion,
art,20000 BCE,Art,"Some of the earliest paintings were found in caves, seem to be drawn for ceremonial, religious purposes.",,,ceremonial-burial,Culture,Social,https://en.wikipedia.org/wiki/Prehistoric_art,
bow,20000 BCE,Bows and arrows,First object to slowly store energy and release it all at once. Much safer to hunt from a distance.,,,stone-tool,War,Invention,https://en.wikipedia.org/wiki/History_of_archery#Prehistory,
oil-lamp,20000 BCE,Oil lamps,"Torches make fire portable, but a primitive lamp is way more convenient.",,,"fire, stone-tool",General,Invention,https://en.wikipedia.org/wiki/Oil_lamp,
animal-dom,12000 BCE,Animals domesticated,"Dogs were first to be domesticated, followed by goats. This enabled hunter gatherers to become shepherds with a much more secure food supply.",,,biped,Agriculture,Technique,https://en.wikipedia.org/wiki/Domestication_of_animals,
agriculture,8000 BCE,Plants domesticated,"Deliberate seed planting and harvesting allowed the same land area support a larger population, but bound farmers to their land. Cities emerged for protection.",,,animal-dom,Agriculture,Technique,https://en.wikipedia.org/wiki/History_of_agriculture,
pottery,7000 BCE,Pottery,"Gourds had to be found, and baskets could only large, dry objects. Pottery began as a technique for waterproofing baskets, and enabled carrying liquids and powders.",,,biped,Culture,Invention,https://en.wikipedia.org/wiki/Pottery#History,
fish-nets,6000 BCE,Linen,Linen made out of interwoven flax fibers enabled strong cords. Interleaving these cords enabled fishing nets and clothing.,,,stone-tool,Agriculture,Invention,https://en.wikipedia.org/wiki/Fishing_net#History,
raft,6000 BCE,Rafts,Lashing logs together to form a floating wooden platform enabled people to cross longer stretches of water.,,,stone-tool,Transportation,Invention,,
sickle,6000 BCE,Sickles,"Stone knives to help cut down stalks, and hand mills in the style of mortar and pestle.",,,"stone-tool, agriculture",Agriculture,Invention,,
irrigation,5000 BCE,Irrigation,"Previously farmers had to rely on rainfall, suffered in droughts and built their farms near rivers, which could also flood. Irrigation ditches allowed farms to plant further from rivers and more deal with flooding.",,,agriculture,Agriculture,Technique,,
scale,5000 BCE,Weight scales,For comparing weights or comparing to a reference weight.,,Egypt,stone-tool,Math,Technique,,
copper,4000 BCE,Copper,"First obtained from metallic nuggets, metals (meaning ""to search for"" in Greek) were smelted using fire, and then molded into desired forms. Still fragile though.",,,"fire, stone-tool",General,Technique,,
simple-sundial,4000 BCE,Simple sundials,A stake placed vertically into the ground gave a general sense of time of day. Likely also split the day into 12 hours.,,Egypt,stone-tool,Transportation,Invention,,
bronze,3600 BCE,Bronze,"Copper is rarely pure in nature, some alloys are poisonous (eg. copper + arsenic), but copper + tin is hard enough to compete with rock.",,,"copper, fire",General,Technique,,
cart,3500 BCE,Wheeled carts,"Even with animals in tow, dragging heavy objects on sleds was tough. Rollers could be added to the sledge, but this was still inefficient. Wheels with rollers inside the cart were a game changer.",,,copper,General,Invention,,
river-boat,3500 BCE,River boats,"Carrying heavy loads on water is far easier than on land: no rocks, no hills, no ridges. Boats were first used on the Nile, which unlike the Tigris is flat and has predictable winds from the north.",,Egypt,raft,Transportation,Invention,,
writing,3500 BCE,Writing,"Earliest use of writing was for ledgers, which led to symbols for fruit, frain, man, and ultimately hieroglyphics.",,Sumer,stone-tool,General,Social,,
plow,3500 BCE,Plows,Scattering seeds on the ground led to random planting patterns. Digging furrows in the soil and planting seeds inside sped up the rate of growth.,,Sumer,agriculture,Agriculture,Invention,,
nation,3100 BCE,Nations,"Irrigation meant more coordination since water was a shared resource. As settlements grew in complexity and density, city-states blended together. This first happened in the Nile delta in Egypt.",,Egypt,agriculture,Culture,Institution,,
candle,3000 BCE,Candles,"Oil could be spilled and spread dangerous fire, By surrounding a flame with animal fat, the solid can illuminate and serve as a container.",,Egypt,"animal-dom, oil-lamp",Culture,Invention,,
calendar,2800 BCE,Calendar,"Some phenomena, like seasons, vary over hundreds of days. The moon cycle is a convenient length (~30 days), and about 12 of them make for a seasonal cycle. ",,Egypt,"sundial, writing",Culture,Invention,,
stone-monument,2650 BCE,Stone monuments,Surplus of food meant more time to dedicate to showcase national greatness or build elaborate tombs for leaders.,,Egypt,"nation, ceremonial-burial",Architecture,Institution,,
literature,2500 BCE,Literature,"Oral storytelling is as old as speech, but writing allowed to codify epics. Gilgamesh is the first written tale.",,Sumer,writing,Culture,Institution,,
glass,2500 BCE,Glass,"Made out of sand and technically a liquid, glass can be made transparent and more beautiful than pottery. Originally used as ornaments, not vessels.",,Egypt,fire,General,Technique,,
empire,2340 BCE,Empires,"Sumerian city states fought one another, eventually Sargon of Akkad conquered Sumer and ruled over people of different languages and cultures, with Akkadians superior.",Sargon,Akkad,nation,Culture,Institution,,
horse,2000 BCE,Horses,"Oxen are strong but dumb and slow, while donkeys are smart but weak. Tamed horses were a good compromise, initially used for driving chariots, eventually much more.",,,animal-dom,General,Technique,,
numbers,1800 BCE,Number system,"Base 60 was first used by Sumer because it is divisible by so many numbers. This is why there are 6*60 degrees in a circle, which is conveniently close to 365. Seven known planets led to the week.",,Egypt,writing,Math,Invention,,
fermentation,1800 BCE,Fermentation,"Fruits that are left standing ferment and form alcohol and other sugars. By 1800 BCE, laws were in place for misdeeds committed while drunk, and the process of leavning bread was perfected.",,Egypt,agriculture,Natural Science,Discovery,,
law,1775 BCE,Code of Laws,"Social conventions work up to a point, but a complex society needs more hierarchy, mistrust, and a need to codify custom. First known law code was inscribed by Hammurabi on an 8-foot tall stone pillar.",King Hammurabi,Babylon,"writing, empire",Culture,Social,,
medicine,1550 BCE,Recorded medicine,"Ancient medical remedies included ritualized behavior, use of plants and animals. First surviving account of medical remedies is called Eber's Papyrus.",,Egypt,"ceremonial-burial,writing",Medicine,Discovery,,
alphabet,1500 BCE,Phonetic alphabet,"To simplify complex ideographic written languages of the time, the Phonecian alphabet instead used a symbol for each sound to construct words.",,Phoenicia,writing,Culture,Social,,
monotheism,1375 BCE,Monotheism,"Earlier humans believed in many supernatural influences, one for each common and abstract object. Amenhotep first accepted just one god (sun), but his reign failed, eventually central to Judaism.",Pharoah Amenhotep IV,Egypt,,Culture,Social,,
dye,1200 BCE,Resistant dyes,"Earlier artists used colored soils for paintings, limited color palette. Blue and red was later found in indigo and madder extracted from plants. One sun and water resistant dye came from snail in Tyre.",,Phoenicia,art,Culture,Invention,,
sea-navigation,1100 BCE,Sea navigation ,"Sea ventures were restricted to coast hugging, and the distant sea was feared and revered (cf. Homer). Phoenicians used the big dipper to find north, and relied on oars to mitigate bad winds.",,Phoenicia,river-boat,Transportation,Technique,,
steel,1000 BCE,Steel,"Smelting using wood never yielded iron because the flame wasn't hot enough. Charcoal, formed by burning wood with low oxygen, burned hot enough to melt iron. Initially too fragile, alloying with carbon yielded steel.",,Hittite,bronze,General,Invention,,
arch,750 BCE,Architectural arches,Two vertical pieces capped by a horizontal roof is simple but weak and not condusive to long spans. Arranging the cover in a semicircular arch is more structurally sound.,,Etruscan,stone-monument,Architecture,Technique,,
aqueduct,700 BCE,Aqueducts,"Cities were built close to fresh water, but as they grew further from the river, needed water delivery infrastructure beyond wells.",Sennacherib,Assyria,"stone-monument, irrigation",Architecture,Technique,,
zoo,700 BCE,Zoos,"Hunting animals for food, sports, artifacts was common. Keeping rare animals in zoos and plants in botanical gardens was first done in Assyria.",Sennacherib,Assyria,animal-dom,Architecture,Institution,,
sundial,700 BCE ,Improved sundials,Gnomon was tilted north and hours were labeled.,,Egypt,simple-sundial,Natural Science,Invention,,
library,640 BCE,Libraries,Books on clay or papyrus were rare and expensive since they had to be manually copied by literate scribes. Only monarchs could accumulate thousands of books.,Ashurbanipal,Assyria,"literature, nation",Architecture,Institution,,
coin,640 BCE,Currency (Coins),"Trade between cultures was done by barter, but required a double coincidence of wants. Gold became the default currency, and was meticulously weighed until coins of standard weight were introduced.",Ardys,Lydia,"scale, nation",Culture,Social,,
eclipse,585 BCE,Solar eclipse predicted,"Eclipses were seen as frightening, evil omens. The first solar eclipse was predicted by Thales on May 28, 585 BCE.",Thales,Greece,"numbers, calendar",Space,Technique,,
water-element,580 BCE,Water as element,What is everything made of? Thales theorized everything was fundamentally made of water. ,Thales,Greece,,Chemistry,Discovery,,
irrational-numbers,520 BCE,Irrational numbers,Pythagoras first believed whole numbers including fractions were the basis of the universe. However what about a unit isoceles right triangle with hypotenuse √2?,Pythagoras,Greece,numbers,Math,Technique,,
realistic-maps,510 BCE,Realistic maps,"A Greek traveler traveled the Persian empire and drew a realistic map covering thousands of miles, including parts of Europe, Africa and Asia.",Hecateus,Greece,"writing, empire",Navigation,Invention,,
ocean-navigation,500 BCE,Atlantic navigation,"Spurred by depleted tin resources needed for bronze, Phoenicians ventured through Gibraltar and into the Atlantic, finding ""tin islands"", potentially Britain. Likely circumnavigated Africa.",,Phonecia,"sea-navigation,bronze",Navigation,Technique,,
cadaver,500 BCE,Human dissection,"Animals had been butchered so much was known about their internal organs, not so humans. Saw arteries, veins, nerves.",Alcmaeon,Greece,"medicine, ceremonial-burial",Medicine,Technique,,
abacus,500 BCE,Abacus,"Each row represents a power of ten, and contains ten beads. A very early and important computing machine.",,Egypt,numbers,Math,Invention,,
venus-named,500 BCE,Venus named,"The Babylonians first saw the evening star (Hesperos), and the morning star (Phorphoros), but these turned out to be the same planet, Venus.",Pythagoras,Greece,,Space,Discovery,,
dream-interpretation,480 BCE,Dream interpretation,"Once viewed as messages from the gods (eg. Joseph in Bible), Heracleitus suggested dreams have no meaning outside one's own thoughts.",Heracleitus,Greece,,Philosophy,Technique,,
atom,440 BCE,Atoms,Leucippus theorized that every event has a natural cause. Democritus expanded this suggesting that all matter was composed of tiny particles.,Democritus,Greece,water-element,Philosophy,Discovery,,
epilepsy,420 BCE,Epilepsy,"Epilepsy the disease discovered. Hippocrates thought disease was due to a misbalance between the four humors: blood, phlegm, bile, black bile.",Hippocrates,Greece,medicine,Medicine,Discovery,,
catapult,400 BCE,Catapult,"Greek hoplites weilding armor, sword and shield were effective against other units but not city walls. Catapults were designed to do that, first artillery.",Dionysius,Greece,"numbers,bow",War,Invention,,
university,387 BCE,Advanced schools,"Plato founded a school on grounds once owned by Academus, so called the Academy. Plato's student Aristotle founded his own school called Lyceum.",Plato,Greece,library,,Institution,,
heliocentricity-theory,350 BCE,Non-geocentric theory,Philolatus thought everything rotated around some central fire (not earth). Ponticus thought maybe Venus and Mercury circled the sun (but sun circles the earth).,Philolaus,Greece,,Space,Discovery,,
logic,350 BCE,Logic,"First formal system of reasoning. Aristotle wrote ""Organon"", describing how to draw conclusions from premises.",Aristotle,Greece,numbers,Math,Technique,,
spherical-earth,350 BCE,Spherical earth theory,"Looking around, the earth looks flat, but over long distances it seems to have curvature (eg. ships hulls dissapear first, then masts). ",Pythagoras,Greece,ocean-navigation,Geography,Discovery,,
five-elements,350 BCE,Five elements theorized,"Aristotle's model had concentric circles of elements: earth at center, surrounded by water, surrounded by air, surrounded by fire (sometimes seen as lightning), and the heavens made of aether.",Aristotle,Greece,atom,Chemistry,Discovery,,
animal-classification,350 BCE,Animal classification,"Dissected 500 species, in particular the dolphin, unlike other fish, seems to have placenta and milk, so classified it with mammals.",Aristotle,Greece,animal-dom,Biology,Discovery,,
star-maps,350 BCE,Star maps,Improved on the best earth maps. The sky is hard to map because there are no physical landmarks. Drew out latitude and longitude lines to identify locations.,Eudoxus,Greece,realistic-maps,Space,Technique,,
botany,320 BCE,Botany book,"Theophrastus, one of Aristotle's students, wrote a book on botany, including 550 plant species.",Theophrastus,Greece,university,Biology,Discovery,,
paved-road,312 BCE,Paved roads,"Once carts and wheels were common, roads were needed. Initially covered by gravel, later paved, roads led to better logistics for commerce and armies.",Appius Claudius,Greece,"stone-monument, cart",General,Invention,,
geometry,300 BCE,Geometry ,"The Greeks took a more theoretical approach to geometry than the applied Egyptians. Euclid's ""Elements"" compiled the axioms (taken as given) and built geometry up from them.",Euclid,Greece,"logic, university",Math,Technique,,
tides,300 BCE,Tides,"Pytheas explored the British Isles, as far as Norway or Iceland. He observed and described tides (not visible in the Mediterranean due to narrowness of Gibraltar)",Pytheas,Greece,ocean-navigation,Navigation,Discovery,,
arteries-veins,300 BCE,Arteries vs veins,"Distinguished between arteries and veins, and thought that arteries carried air.",Praxagoras,Greece,cadaver,Medicine,Discovery,,
brain-areas,280 BCE,Parts of brain,"Herophilus divided nerves into sensory and motor, described the retina. Erasistratus distinguished the cerebrum and cerebellum. Then paused for religious reasons.","Erasistratus, Herophilus",Greece,cadaver,Medicine,Discovery,,
moon-sun-size,280 BCE,Moon and sun size estimate,"When Anaxagoras suggested the Sun was the size of Greece, he was exiled. 200 years later, Aristarchus estimated sun to be gigantic and venus/mars as comparable in size to Earth.",Aristarchus,Greece,"geometry,heliocentricity-theory",Space,Technique,,
lighthouse,280 BCE,Lighthouses,"The Lighthouse of Alexandria (at Pharos) stood 280 ft high, with stairs to carry wood up. The light of the burning wood was visible 35 miles out.",,Greece,"ocean-navigation,stone-monument,geometry",Navigation,Technique,,
water-clock,270 BCE,Water clocks,"Sundials only work when there's sun, and aren't portable. Hourglasses and candles could also work. Water clocks were more precise, but still crude.",Ctesibius,Greece,"sundial, nation",Math,Invention,,
lever-math,260 BCE,Lever mathematics,"Levers have been used for a long time, but Archimedes calculated the math. Archimedes also worked out buoyancy and estimated the value of pi to be 3.142.",Archimedes,Greece,"logic, university",Math,Technique,,
earth-size,240 BCE,Earth size estimate,"In Aswan, the sun is directly overhead. By comparing it to the 7 deg offset in Alexandria and using the cities' relative location Eratosthenes estimated earth circumference to be 25k miles.",Eratosthenes,Greece,"geometry, river-boat",Geography,Discovery,,
year-number,240 BCE,Standardized years,"Formerly years were called ""the seventh year of King X"". Eratosthenes matched these dates onto a global timeline.",Eratosthenes,Greece,calendar,Culture,Social,,
great-wall,214 BCE,Great Wall,"Great Wall is largest construction project ever. First made of earth, later of brick, extending for 1500 miles. Shih Huang Ti burned all known books in 214 BCE, explaining why little is known about China before then. ",Shih Huang Ti,China,stone-monument,Architecture,Technique,,
parchment,170 BCE,Parchment,"Egypt was the only source of papyrus, and they were not eager to share. Parchment from treated animal skins is more durable, can be reused, but is expensive.",Eumenes II,Pergamum (Greece),animal-dom,Culture,Invention,,
moon-distance,150 BCE,Distance to moon estimate,Hipparchus made the first trig tables. He used trig to calculate the moon's parallax by comparing its position to the stars from multiple points on earth.,Hipparchus,Greece,"geometry, river-boat",Space,Discovery,,
star-maps-better,134 BCE,Better star maps,"Improved on the previous star maps by including magnitudes, and including over a thousand stars, and incorporating lat long from earth maps.",Hipparchus,Greece,star-maps,Space,Technique,,
glass-blowing,100 BCE,Glass blowing,"Previously, glass was hard to manipulate, but it was found that glass could be blown like a soap bubble. Glass became cheaper and could be used for vessels.",,Syria (Greece),glass,,Technique,,
water-wheel,85 BCE,Waterwheels,Human and animal muscle was expensive. What if you could use inanimate forces like wind pushing sails? First powered mills.,,,cart,Power,Invention,,
julian-calendar,46 BCE,Julian calendar,"Julian calendar adopted, inspired by Egyptian calendar. Some months had 30 and some 31 days. An extra day every four years (leap).",Sosigenes,Greece,"year-number,calendar",,Institution,,
climactic-zone,25,Climactic zones,"Mela suggested earth be divided into north and south frigid zones around the poles, a torrid zone around the equator and temperate zones in between.",Pomponius Mela,Greece,"realistic-maps,spherical-earth",,Discovery,,
medicinal-plants,50,Recorded medicinal plants,"After serving as a medic in Roman army, he wrote ""Materia Medica"" which described 600 plants, 1000 drugs. Start of pharmacology.",Pedanius Dioscorides,Greece,medicine,Medicine,Discovery,,
steam-engine,50,Rudimentary steam engine,"Worked like a modern lawn sprinkler, using the force of flowing steam for motion. Had no bearing on society.",Hero,Greece,fire,Energy,Invention,,
paper,105,Paper,"Instead of relying on expensive reed, process made paper from any tree. Took 1000 years to reach Europe.",Tsai Lun,China,parchment,Storage,Invention,,
geocentric-universe,140,Geocentric universe,Ptolemy wrote that the sun and planets rotate around the earth in circular planets and worked out the math for predicting planetary motions. Remained canon for 14 centuries.,Ptolemy,Greece,star-maps-better,Space,Discovery,,
spinal-cord,180,Spinal cord,Galen worked at a gladiator school which gave him insights into human anatomy. He also cut animals’ spines to see resulting paralysis.,Galen,Greece,medicine,Medicine,Discovery,,
algebra,250,Algebra,"Most Greek math focused on geometry, but Diophantus focused on problems that were less visual, usually equations with multiple unknowns.",Diophantus,Greece,geometry,Math,Technique,,
tea,250,Tea,Reduced infection since it required water to be boiled,,China,,,Discovery,,
alchemy,300,Recorded alchemy ,"Chemical change was intuitively understood: pottery from clay, metals from ore, glass from sand. Zosimus summarized ancient alchemy. Ultimately led nowhere.",Zosimus,Egypt (Greece),five-elements,Chemistry,Technique,,
metal-stirrup,300,Metal stirrups,"Larger horses were bred to carry more, so riders were carried on saddles. Stirrups gave more stability for the rider and enabled to strike from horseback.",,China,"steel, horse",War,Invention,,
wheelbarrow,400,Wheelbarrows,A one wheeled cart that relied on lever action to carry a lot more than a human can. Potentially invented much earlier than 400.,,China,steel,Farming,Invention,,
dome,537,Architectural domes,Advanced dome making techniques perfected. The Hagia Sophia was 108 feet across and 180 feet high.,Emperor Justinian (funder),Rome,"geometry, arch",Architecture,Technique,,
silk-europe,552,Silk in Europe,"Silk was in high demand in Rome and expensive, so Justinian arranged to bring back silkworms and the silk making process from China. By 552 Constantinople was producing.",Emperor Justinian (funder),Rome/China,paved-road,Biology,Social,,
turnplow,600,Turnplows,"A plow with a vertical knife-blade that cut deep into the earth. Useful for damp, moist ground, led to increase in carrying capacity.",,Slavs,"plow, steel",Agriculture,Invention,,
greek-fire,673,Greek fire,"The Greeks devised a napalm-like weapon which would continue to burn on water, enabled them to defend Constantinople from Arab invaders through terror.",Callnicus,Byzantium,"catapult, alchemy",War,Invention,,
porcelain,700,Porcelain,"Eventually came to Europe, known as “China” and became the luxury replacement for wood dishes.",,China,pottery,Culture,Invention,,
acetic-acid,750,Acetic acid,Arabs continued the Greek alchemical tradition and sought to find an elixir of life. Instead Geber found a way to distill vinegar into acetic acid.,Jamir bin Hayyan (Geber),Arabia,fermentation,Chemistry,Discovery,,
iron-horseshoes,770,Iron horseshoes,"Horses were actively used for war, farming, transport. By this time horseshoes were coming into common use, protecting horse hooves from rocks.",,Europe,"steel, horse",General,Invention,,
zero,810,Zero,"Around 500, an Indian mathematician suggested using the symbol ""0"" to represent an untouched abacus level. This came to the Arabs and was used in Al-Khwarizmi's book on algebra.",Muhammad bin Al-Khwarizmi,Arabia,"algebra, abacus",Math,Technique,,
coffee,850,Coffee,"Lacking safe drinking water, you could either drink alcohol or boil tea. Muslims were prohibited from alcohol and didn't know about tea.",,Arabia,,Culture,Discovery,,
arctic-circle,870,Arctic circle,"First crossing into the arctic circle. Ottar rounded North Cape (125 miles north of the arctic circle), and entered the White Sea.",Ottar,Viking,ocean-navigation,Geography,Discovery,,
iceland-settled,847,Iceland settled,"Europe’s first expansion to new land overseas. Iceland first discovered around 550 by Brendan, an Irishman",Ingolfur Arnarson,Viking,ocean-navigation,Geography,Discovery,,
horse-collar,900,Horse collars,"Allowed horses to pull by their shoulders not their windpipe, increasing pulling capacity by 5x. Power began to shift from the Mediterranean area to Northern Europe.",,Europe,"turnplow, iron-horseshoes",,Invention,,
greenland,982,Greenland,"Just 200 miles from Iceland, Vikings settled SW shores of Greenland and stayed there for four centuries.",Erik the Red,Viking,iceland-settled,Geography,Discovery,,
newfoundland,1000,Newfoundland discovered,"Leif, Erik's son continued westward, discovered Vinland but the settlement did not last long.",Leif Ericksson,Viking,greenland,Geography,Discovery,,
optics,1025,Optics,Human vision understood and vision correcting lenses invented. Foundation of the field of optics.,Alhazen,Arabia,glass-blowing,Medicine,Invention,,
crossbow,1050,Crossbows,"First mechanized handheld weapon. Range of 300m, penetrated chainmail",,France,"lever-math, steel",War,Invention,,
new-star,1054,New star,Creation of new star witnessed. Went unnoticed in Europe.,,China,,Space,Discovery,,
bright-comet,1066,Bright comets,"Comets were observed but very mysterious, widely considered a bad omen.",,France,,Space,Discovery,,
fork,1071,Forks in Europe,"Forks originated in Byzantium and arrived in Venice. Knives and spoons were known, but people ate with fingers.",,Byzantium,paved-road,Culture,Invention,,
flying-buttress,1137,Flying buttresses,"To build tall structures, Roman architects had to build thick walls and minimize windows, leading to gloom. Key points could be buttressed with arched supports, leaving the wall thin and full of windows.",Suger,France,"dome, arch",Architecture,Technique,,
