ID,Year,Title,Description,Inventor,Location,Dependencies,Field,Type,URL,pg#
probability,1654,Probability,"Consulting with Pascal and Fermat, a certain gambler wanted to understand why he kept losing at dice. These greats formulated a mathematics for considering a large number of random events, unpredictable on their own, but in predictable in aggregate.",Chevalier de Mere,France,cryptanalysis,Math,Technique,,
air-pressure,1654,Early pneumatics,Demonstrated power of air pressure through experiments: fifty men struggled to pull a cylinder out of a vacuum. Teams of horses tried to separate two hemispheres sealed in a vacuum.,Otto von Guericke,Germany,air-pump,Natural Science,Technique,,
saturn-ring,1656,Saturn's ring,"Build a large telescope (23ft long) with better lens grinding techniques, and were able to see Saturn’s rings, which eluded Galileo. Also saw Orion Nebula rather than a single star.",Christian Huygens and Baruch Spinoza,Netherlands,telescope,Space,Discovery,,
pendulum-clock,1656,Grandfather clocks,An ordinary pendulum swings in the arc of a circle and doesn’t have a constant period (?). But a cycloid trajectory enables a constant period. The clock involved counterweights and a cycloid always pendulum and could tell time far better than its predecessor.,Christian Huygens,Netherlands,pendulum,Natural Science,Invention,,
falling-bodies,1657,Falling motion experiment,"Definitive experiment created a vacuum (mitigating air resistance) using an air pump and dropped feather and coin at the same time, and they fell at the same speed",Robert Hooke,England,"air-pump, falling-bodies",Natural Science,Discovery,,
red-blood-cells,1658,Red blood cells,"Red blood cells first seen in blood w/ microscope. Due to improvements in microscopes in 1650s, Swammerdam studied insects. Father of modern entomology (study of insects).",Jan Swammerdam,Netherlands,microscope,Medicine,Discovery,,
syrtis-major,1659,Syrtis Major,Dark triangular marking on Mars,Christian Huygens,Netherlands,telescope,Space,Discovery,,
capillaries,1660,Capillaries,"Capillaries first seen under microscope. Previous unclear was how blood got from arteries to veins (to get back to heart). Harvey's theory suggested that there should be vessels, but they were too small to see.",Marcello Malpighi,Italy,blood-circulation,Medicine,Discovery,,
static-electricity,1660,Static electricity,"First demonstration of static electricity at scale. Inspired by attractive forces from rubbing amber (elektron in Greek), Guericke built a sulfur globe that could be rotated to generate a lot of static electricity and then produce sparks.",Otto von Guericke,Germany,,Natural Science,Technique,,
chemical-elements,1661,Scientific chemistry,"Definition of chemical elements. 2000 years after Aristotle's 4 elements, published ""The Skeptical Chymist"", changing the name alchemist => chemist.  Suggested defining elements as components that can't be converted into anything simpler.",Robert Boyle,England,five-elements,Natural Science,Discovery,,
acid-base,1661,Acid-base balance,"Acid-base balance is necessary for health. Supplanted the 4 humor theory (bile, blood, phlegm, black bile) with acid-base balance. Suggested digestion was more chemical than mechanical.",Franz Deleboe,Netherlands,epilepsy,Medicine,Discovery,,
boyles-law,1662,Boyle's law,Experiments in compressing gas showed an inverse relationship between volume and pressure in gas.,Robert Boyle,England,air-pressure,Natural Science,Discovery,,
royal-society,1662,Royal Society,"The English Royal Society became the first scientific society, other nations modeled theirs after it. Legal charter.",Charles II,England,scientific-societies,Natural Science,Institution,,
jupiter-red-spot,1664,Jupiter's Red Spot,It's so huge the whole Earth could fit inside.,Robert Hooke,England,telescope,Space,Discovery,,
cell,1665,Cells,"Published Micrographia which outlined his work. Looked at structure of cork, saw dead cells. First use of the term ""cell""",Robert Hooke,England,microscope,Medicine,Discovery,,
light-diffraction,1665,Diffraction,Saw light bending around objects. First inkling that light may have wave like properties.,Francesco Maria Grimaldi,Italy,optics,Natural Science,Discovery,,
planet-rotations,1665,Planetary rotation,"All planets rotate around their own axes. Discovered that Mars has a period of 24h40m, Jupiter 9h56m.",Gian Domenico Cassini,Italy,telescope,Space,Discovery,,
light-spectrum,1666,Prisms,First observed light spectrum. Used a prism to see a band of colors emerge from white light. Then used another prism to recombine it back into white light.,Isaac Newton,England,"telescope,microscope",Natural Science,Discovery,,
conservation-momentum,1668,Conservation of momentum,Momentum (p=mv) must be conserved in a closed system. First of the fundamental conservation laws.,John Wallis,England,falling-bodies,Natural Science,Discovery,,
no-spontaneous-generation,1668,No spontaneous generation,Devised a biological experiment with controls (first of its kind) to see if spoiled meat in a sealed flask would generate maggots. Answer: no.,Francesco Redi,Italy,,Natural Science,Discovery,,
reflecting-telescope,1668,Reflecting telescopes,Previous refracting telescopes suffered from chromatic abberation (which Newton studied in detail with prisms). New design used a curved mirror instead of a lens.,Isaac Newton,England,light-spectrum,Natural Science,Invention,,
calculus,1669,Calculus,"Working out laws of gravity, Newton needed a new mathematical tool. Simultaneous discovery with Liebnitz, led to epic scientific conflict for centuries.",Isaac Newton / Gottfried Wilhelm Liebniz,England / Germany,analytic-geometry,Math,Technique,,
phosphorus,1669,Phosphorus,Nine modern elements were known at the time (eg. gold) but their discoverers were unknown. Brand discovered Phosphorus in an attempt to create gold out of urine.,Hennig Brand,Germany,chemical-elements,Natural Science,Discovery,,
fossils,1669,Fossils,Fossils first identified as petrified remnants of life. View eventually prevailed. Spectacular evidence of evolution.,Nicolaus Steno,Denmark,mineralogy,Geography,Discovery,,
double-refraction,1669,Double refraction,"Also known as birefringence, the phenomenon involves multiple paths of light going through a calcite prism. One of the paths is polarized. (TIL).",Erasmus Bartholin,Netherlands,optics,Natural Science,Discovery,,
blood-color,1669,Blood colors,Observed different colors of blood. His work Tractatus de Corde first documented that dark red blood in veins turned brighter red from contact with air.,Richard Lower,England,arteries-veins,Medicine,Discovery,,
diabetes,1670,Diabetes diagnosed,May have been known by ancients that diabetic urine was sweet from all of the flies that accumulated.,Thomas Willis,England,,Medicine,Discovery,,
saturn-satellites,1671,Saturn's four moons,"Huygens thought that the 6 known satellites (4 around Jupiter, Titan around Saturn and Moon around Earth) matched the 6 known planets, so that was that. Cassini proved him wrong.",Gian Domenico Cassini,Italy,telescope,Space,Discovery,,
mars-distance,1672,Mars distance,"Two millenium before, estimates of distance to Moon was established, but no other astronomical distances since. Cassini determined position of Mars as seen from Paris. Also determined size of solar system in general. Calculated Saturn orbit (farthest known planet) was at least 1.6e9 miles across",Gian Domenico Cassini,Italy,even-better-planetary-tables,Space,Discovery,,
speed-of-light,1675,Speed of light,"Estimated speed of light. Galileo tried to record speed of light, but failed. Roemer observed Jupiter's satellites from Paris Observatory, found eclipses were earlier at times of year when Earth was approaching Jupiter, and later when receding. Estimated c to be 3/4 of its actual value.",Olaus Roemer,Denmark,telescope,Natural Science,Discovery,,
saturn-rings,1675,Saturn's multiple rings,"Cassini observed a dark line separating inner and outer ring. Known as ""cassini's division""",Gian Domenico Cassini,Italy,telescope,Space,Discovery,,
microorganisms,1676,Microorganisms,"Used small single lenses ground expertly to produce 200x magnification. Observed ""animalcules"" in pond water. Also first detected spermatazoa in semen.",Antoni van Leeuwenhoek,Netherlands,microscope,Natural Science,Discovery,,
southern-stars,1678,Southern stars,"First systematic observations of southern skies. Southern sky was never visible to Europeans. Halley traveled to St. Helena in south Atlantic, returned with a catalog of 341 southern stars.",Edmond Halley,England,"telescope, india-water-route",Space,Discovery,,
light-waves,1678,Light as wave,"Light: particle or wave controversy grew sharper. Newton couldn't see how light was a wave (there is nothing to wave), Huygens thought light traveled through an aether.",Christian Huygens,Netherlands,optics,Natural Science,Discovery,,
pressure-cooker,1679,Pressure cookers,First useful application of steam. Tightly fitted lid increased boiling point of water to cook meat faster.,Denis Papin,France,steam-engine,Natural Science,Invention,,
muscles-bones,1680,Human kinetics,"Mechanical model for human kinetics. Modeled human bone and muscle as a system of levers, applying the same laws of physics to our body.",Giovanni Alfonso Borelli,Italy,lever-math,Medicine,Technique,,
dodo-extinction,1681,Dodo extinct,Dodo became first anthrogenic extinction. Mauritius had many species that evolved in isolation and were different from elsewhere. Dodo had no natural predators until the Dutch came and gradually killed them all.,,Netherlands,india-water-route,,Discovery,,
plant-sexuality,1682,Plant sexuality,"Some plants shown to reproduce sexually, sexual plant organs, that plant pollen is equivalent to animal sperm. Previously, plants were assumed to be semi-alive (eg. in Genesis, they appear alongside dry land)",Neremiah Grew,England,botany,Natural Science,Discovery,,
bacteria,1683,Bacteria,"Continuing to rely on his excellent lenses, saw even smaller organisms than ""animalcules"", which in retrospect turned out to be bacteria.",Antoni van Leeuwenhoek,Netherlands,microorganisms,Natural Science,Discovery,,
earth-size-accurate,1684,Earth size accurate,"Improvement over Eratosthenes' estimate based on distance of a star from zenith at different places using the help of telescopes. Estimate for radius was 3950 miles (actual 3,958.8)",Jean Picard,France,telescope,Space,Discovery,,
imaginary-numbers,1685,Complex numbers,First used the complex plane to represent i=sqrt(-1).,John Wallis,England,negative-numbers,Math,Technique,,
meteorological-map,1686,Trade winds mapped,"First world map showing consistent winds. Seasonal winds called monsoons come from the arabic word meaning ""season"". These and steady winds were never documented before. Halley hinted at sun-heated air but didn't understand reason for westward flow.",Edmond Halley,England,world-maps,Geography,Technique,,
plant-classification,1686,Plant species classified,"Published a volume classifying 18600 different plant species, including a pretty good taxonomy.",John Ray,England,animal-classification,Natural Science,Discovery,,
laws-motion,1687,Laws of motion,"Since Kepler discovered eliptical orbits, many scientists tried to understand the underlying laws. Eventually Newton published Principia, widely considered greatest science book ever written. Included three laws of motion.",Isaac Newton,England,elliptical-planetary-orbits,Natural Science,Discovery,,
universal-gravitation,1687,Universal graviation,Formulation of the force of gravity between any two bodies (that F=G m1 m2 / d^2) explained bodies in known universe.,Isaac Newton,England,laws-motion,Natural Science,Discovery,,
shape-of-earth,1687,Non-spherical earth,"Earth shape suggested as oblate spheroid. When Richer traveled to Cayenne to determine Mars parallax, found pendelum beats slower there than in Paris. Newton suggested that this was due to difference in gravity at equator vs. at poles. This would mean earth would bulge.",Isaac Newton,England,"universal-gravitation, planetary-tables",Natural Science,Discovery,,
plate-glass,1688,Plate glass,"Techniques for making glass without blowing. Clear glass was a luxury until in France, large sheets of glass were made for mirrors and windows, and went into widespread use.",,France,glass-blowing,,Technique,,
animal-classification-improved,1691,Improved animal classifications,"Classified animals logistically based on hooves, toes, and teeth.",John Ray,England,animal-classification,Natural Science,Discovery,,
calculating-machines,1693,Calculating machines,"Built the Step Reckoner, a mechanical aid to calculation of trig and astronomical tables.",Gottfried Wilhelm Liebniz,Germany,adding-machine,Math,Invention,,
mortality-tables,1693,Mortality tables,He produced a life table showing the number of people surviving to any age from a cohort born the same year,Edmond Halley,England,probability,Math,Technique,,
miners-friend,1698,Miner's friend,"Miner's Friend invented to pump water out of flooded mines. Steam-powered air pump to help English coal mining, which was increasingly relied upon because of shortage of wood. ",Thomas Savery,England,air-pump,Natural Science,Invention,,
scientific-voyages,1698,Scientific ocean voyages,"First ocean voyage exclusively for science. Prior, voyages were taken for exploration, settlement or trade, with science as a side-effect. Halley's voyage measured magnetic declinations around the world, prepared first map of the world showing isodeclination, and accurate lat/long for ports. ",Edmond Halley,England,india-water-route,Natural Science,Institution,,
gas-volume-temperature,1699,Gas volume temperature,"Discovery that volume of gas proportional to temperature. A step towards gas laws, but not quite precise enough measurements yet.",Guillaume Amontons,France,air-pressure,Natural Science,Discovery,,
binary-system,1700,Binary system,"First use of non-decimal bases (8, 12) as well as binary system.",Gottfried Wilhelm Liebniz,Germany,decimal-notation,Math,Invention,,