ID,Year,Title,Description,Inventor,Location,Dependencies,Field,Type,URL,pg#
windmill,1180,Windmills in Europe,"Windmills were invented around 700, brought to France from Persia. Unlike water wheels, didn't require a river. First they had to be turned manually to face the wind, later the wind itself caused the mill to face it.",,Persia,water-wheel,Energy,Invention,,
compass,1180,Magnetic navigation,"Magnetism was known by Greeks and Chinese before, but now magnetic compasses were used for navigation, allowing to find north everywhere, regardless of cloud cover.",Alexander Neckham,England,ocean-navigation,Transportation,Invention,,
spitsbergen,1194,Spitsbergen,Spitsbergen are islands 500 miles north of Norway. Vikings discovered them but they remained unknown to Europe.,,Viking,ocean-navigation,Geography,Discovery,,
arab-numbers,1202,Arabic numerals in Europe,"Popularized by Fibonacci, who brought them back from his travels in North Africa, they existed in parallel with Roman numerals for 3 centuries.",Al-Khwarizmi,Arabia,"zero, sea-navigation",Math,Invention,,
coal-mining,1228,Coal mining,"English forests were getting depleted as uses for fire increased. Initially coal was found sporadically and burned immediately, but demand grew and it was first mined in Newcastle. ",,England,"fire, steel",Energy,Technique,,
rudder,1241,Rudders in Europe,"Prior, ships were steered with a broad oar dragged from the back of the boat. Integrated rudders became widely used by ships of Hanseatic League, a trading guild in north Europe.",,Arabia,ocean-navigation,Transportation,Invention,,
eyeglass,1249,Eyeglasses invented,Invented in China around the same time. Initially just convex lenses for far sighted folks.,Roger Bacon,England,optics,Natural Science,Invention,,
gunpowder-europe,1249,Gunpowder in Europe,"Previously used by the Chinese to scare off mongols, gunpowder was perfected by Europeans to make it a serious weapon.",,China,"fire, paper",War,Invention,,
planetary-tables,1252,Planetary tables,"More accurate than Ptolemy's geocentric model, called Alfonsine tables.",Alfonso X (funder),Castile,geocentric-universe,Space,Discovery,,
magnetic-pole,1269,Magnetic poles,"Magnetic poles discovered, magnetic principles understood. Compass was improved by placing the magnetic needle on a pivot and overlaying it on a circular scale.",Pelerin de Maricourt,France,compass,Navigation,Discovery,,
mirror,1291,Mirrors,"Previously all glass was colored, but in Venice, a discovery was made that allowed clear glass. After that, all it took was a backing metal surface to make a mirror.",,Venice,"glass-blowing,steel",Culture,Invention,,
far-east,1298,Far east by Europe,Far east became a wonder-goal for European dreamers.,Marco Polo,Venice,paved-road,Geography,Discovery,,
spinning-wheel,1298,Spinning wheels,"Previously done by hand, spinning wheels made the process much easier. Initially invented in India and used a belt drive.",,India,lever-math,General,Invention,,
longbow,1298,Longbows,"Twice the range of a crossbow, far greater force. Big implications for war, and gave England a huge advantage for a century.",,Wales,"crossbow, bow",War,Invention,,
sulfuric-acid,1300,Sulfuric acid,"Far stronger than acetic acid, most widely used industrial chemical used today. Inventor unknown, known as False Geber for signing off as Geber.",,Arabia,acetic-acid,Chemistry,Discovery,,
distillation,1300,Liquor distillation,Much faster than waiting for natural fermentation. Villanova made Brandy,Arnau de Villanova,Spain,fermentation,Chemistry,Invention,,
comet-painting,1304,Realistic comets,"First realistic depiction of a comet as seen by naked eye. Painted in ""Adoration of the Magi"".",Giotto di Bondone,Italy,"art,bright-comet",Space,Discovery,,
canary-islands,1312,Canary islands by Europe,Originally discovered in 40 BCE by King of Mauritania. First expansion of Europe overseas.,,Geona,ocean-navigation,Geography,Discovery,,
anatomy,1316,Anatomy book,"After a ban, cadaver dissection became possible again and de Luzzi wrote the definitive Anatomy book for next 2.5 centuries.",Mondino de Luzzi,Italy,cadaver,Biology,Discovery,,
mechanical-clock,1335,Mechanical clocks,"Weight-powered, more convenient and easier to maintain than water clocks. Hourly chimes.",,Italy,water-clock,,Invention,,
cannon,1346,Cannons,Primitive cannons used at siege of Metz.,Edward III (funder),England,catapult,War,Invention,,
quarantine,1403,Quarantine,Venician policy was to delay strangers from entering the city until a waiting period had passed (40 days).,,Venice,medicine,Medicine,Discovery,,
indian-ocean,1405,Indian ocean,"Led expedition to Red Sea, India, Ceylon, brought back ruler of Ceylon as prisoner.",Cheng Ho (Zheng He),China,ocean-navigation,Geography,Discovery,,
madeira,1418,Madeira settled,Kicked off the European Age of Exploration,Prince Henry the Navigator,Portugal,ocean-navigation,Geography,Discovery,,
azores,1427,Azores,"1/3 of the way to America. Like Madeira, originally uninhabited, also still part of Portugal",Diogo de Sevilha,Portugal,madeira,Geography,Discovery,,
perspective,1436,Perspective drawing,Book published about how to draw in perspective,Leon Battista Alberti,Italy,optics,Art,Invention,,
artillery,1439,Artillery,Improved upon cannons. Artillery was good against city walls,Jean and Gaspard Bureau,England,cannon,War,Invention,,
arquebus,1450,Arquebus,First gun small enough to be fired by one person,,Spain,artillery,War,Invention,,
concave-lenses,1451,Concave lenses,Previous lenses (convex) were only for farsighted people,Nicholas of Cusa,Germany,eyeglass,,Invention,,
movable-type,1454,Movable type,Proto-printing was done by Sumerians and Chinese,Johannes Gutenberg,Germany,paper,Writing,Invention,,
comet-tracking,1472,Comet trajectory tracking,"Comets usually viewed with terror, now understood rationally.",Johann Muller,Germany,optics,Space,Discovery,,
cape-good-hope,1487,Cape of Good Hope,"Initially called Cape of Storms, renamed as Good Hope by John II who knew it would open trade routes with orient",Bartholomeu Diaz,Portugal,ocean-navigation,Geography,Discovery,,
new-world,1492,New world (Europe),"Funding from Spain, first landing: Bahamas.",Christopher Columbus,Italy,ocean-navigation,Geography,Discovery,,
magnetic-declination,1492,Magnetic declination,Saw declination of the compass compared to the stars,Christopher Columbus,Italy,magnetic-pole,Navigation,Discovery,,
syphilis,1495,Syphilis,Breakout during siege of Naples by France. Named after the protagonist of a poem that had syphilis.,,Italy/France,quarantine,Medicine,Discovery,,
india-water-route,1497,India water (Europe),Lost 3/5 of crew to scurvy.,Vasco da Gama,Portugal,cape-good-hope,Geography,Discovery,,
america,1502,America  (Europe),Realized they weren't in Asia,Amerigo Vespucci,Italy,new-world,Geography,Discovery,,
hand-watch,1504,Spring-powered watches,"Allowed much smaller, non-vertical clocks",,,mechanical-clock,,Invention,,
pacific-ocean,1513,Pacific ocean (Europe),"In search of asian wealth, crossed panama to get to the Pacific. Called it the ""south sea"".",Nunez de Balboa,Spain,ocean-navigation,Geography,Discovery,,
florida,1513,Florida,First portion of USA to be settled by Europeans,Ponce de Leon,Spain,pacific-ocean,Geography,Discovery,,
mexico,1519,Mexico conquered,"17: Landed on Yucatan, traces of Maya 19: landed and went to war",de Cordoba/Cortez,Spain,pacific-ocean,Geography,Discovery,,
around-earth,1523,Earth circumnavigated,"Didn't know Magellan died in Guam, not technically finishing",Ferdinand Magellan,Potugal,pacific-ocean,Geography,Discovery,,
peru,1531,Peru conquered,Spain held it for 3 centuries,Francisco Pizarro,Spain,pacific-ocean,Geography,Discovery,,
cubic-equations,1535,Cubic equations,Quadratic equations had been solved for a long time,Niccolo Tartaglia/Geronimo Cardano,Italy,algebra,Math,Technique,,
comet-tails,1538,Comet tails,Comet tails always point away from the sun. News to me! Also independently discovered by Peter Bennewitz,Girolamo Fracastoro,Italy,comet-tracking,Space,Discovery,,
mississipi-river,1541,Mississipi river (Europe),Commisioned by Charles V,Hernando de Soto,Spain,america,Geography,Discovery,,
amazon-river,1542,Amazon river (Europe),"Actually went west to east, from Quito to Marajo",Francisco de Orellana,Spain,america,Geography,Discovery,,
heliocentricity-practice,1543,Mathematics of heliocentricity,Still kept the concentric circle constraint the Greeks proposed but greatly improved math.,Nicolaus Copernicus,Poland,heliocentricity-theory,Math,Technique,,
illustrated-anatomy,1543,Illustrated anatomy book,"Published ""Concerning the Structure of the Human Body"" including illustrations of human anatomy",Andreas Vesalius,Flanders,"anatomy, art",Natural Science,Invention,,
negative-numbers,1545,Negative numbers,"First used to represent debt. Also negative integers, fractions, irrationals.",Geronimo Cardano,Italy,algebra,Math,Invention,,
surgery,1545,Rational surgery,"Improved surgical techniques, eg. tying off arteries rather than burning.",Ambroise Pare,France,anatomy,Medicine,Technique,,
trig-tables,1551,Trigonometric tables,Built tables of angle ratios to make astronomy calculations easier,Rhaticus,Germany,heliocentricity-practice,Math,Technique,,
better-planetary-tables,1551,Better planetary tables,Used Copernicus' math to improve over previous planetary tables.,Erasmus Reinhold,Germany,planetary-tables,Space,Invention,,
eustacian-tubes,1552,Eustacian tubes,"Described tube going from ear to throat, as well as adrenal glands published a new anatomy book",Bartolommeo Eustacio,Italy,illustrated-anatomy,Medicine,Discovery,,
northeast-passage,1553,Northeastern passage,First crossing through northeastern passage landed in Archangelsk (so not quite the whole way to asia). Improved Russia-English trade relations,Richard Chancellor,England,arctic-circle,Geography,Discovery,,
homologies,1555,Vertebrate skeletons,"Similarities between vertebrate skeletons documented, noted that number of bones in limbs were often constant regardless of animal species. Foreshadowed evolution",Pierre Belon,France,anatomy,Natural Science,Discovery,,
mineralogy,1556,Mining book,Basically founded Mineralogy. Also contributed: Theophrastus Bombastus von Hohenheim (best name ever?),Georg Bauer (Agricola),Germany,coal-mining,Natural Science,Technique,,
tobacco,1556,Tobacco (Europe),"Europeans learned about Tobacco from Native Americans. Nicotine named after Nicot, ambassador to Portugal who sent tobacco seeds to France.",Jean Nicot,France,america,Culture,Discovery,,
scientific-societies,1560,Scientific societies,"First scientific association for idea exchange “Academy of the Mysteries of Nature” was closed down by the inquisition shortly, but others formed later.",Giambattista Della Porta,Italy,university,Culture,Institution,,
musket,1565,Musket,"Arquebus was further refined into a Musket, first weapon to pierce armor. Armor penetrating meant armor was obsolete. Muskets remained principle small arms for 2 centuries",,,arquebus,War,Invention,,
world-maps,1568,Mercator projection,"Main feature of Mercator projection: movement in a fixed compass direction appears as a straight line on the map. The cover of the book showed Atlas holding the world on his shoulders, this is why books of maps are called atlases.",Gerardus Mercator (orig. Gerard Kramer),Flanders,"realistic-maps, geometry",,Invention,,
supernova,1572,Supernova (Europe),Observed the process over 485 days (until it became invisible). Notion of heavenly immutability destroyed.,Tycho Brahe,Denmark,new-star,Space,Discovery,,
greenland,1576,Greenland revisited,"Discovered Baffin Island, and second time around, Greenland rediscovered. All Vikings settlers had died or left. No viable NW passage path",Martin Frobisher,England,northeast-passage,Geography,Discovery,,
comet-distance,1577,Comet distances,"Distance to comets proven to be far beyond previous notions. Greeks thought comets were atmospheric phenomenon (!), but Tycho saw no parallax in the comet’s trajectory, proving it was far.",Tycho Brahe,Denmark,telescope,Space,Discovery,,
drake-strait,1578,Drake Strait,"Discovered a passage around the southernmost tip of South America. Attempting to find Straight of Magellan, which weaves through South American continent (far south), Drake overshot and found an even more southern passage. Coming back around he got as far as SFBA. 60 years after Magellan this was only the second circumnavigation of the world.",Francis Drake,England,around-earth,Geography,Discovery,,
pendulum,1581,Time pendulums,"First inkling that pendulums might have good time-keeping properties. Most time keeping done via heart rate, dripping water, burning candle, etc. (Surprising, given mechanical watches previously invented)",Galileo Galilei,Italy,mechanical-clock,Natural Science,Technique,,
siberia,1581,Siberia settled (Europe),"Driven by fur trade, Russia expanded east. Timofievich conquered last Mongol kingdom named Sibir. Eventually paved the way to Russians in the Pacific.",Yermak Timofievich,Russia,,Geography,Discovery,,
gregorian-calendar,1582,Gregorian calendar,"Pope mandated a calendar switch, causing holidays to be more aligned with seasons. A leap year every 4 years means a year is 365.25 days, but it’s actually 365.2422 days long. To avoid error new calendar introduced a new rule. Instead of 1/4, 97/100 had to be leap years. To adjust for the offset, 10 days were dropped on October 4, 1582. The next day was October 15.",Christoph Clavius,Rome,julian-calendar,Culture,Technique,,
hydrostatics,1583,Hydrostatics,Foundational experiment: pressure of liquid on surface depends on height of liquid and area of surface but not shape of vessel,Simon Stevin,Netherlands,,Natural Science,Discovery,,
decimal-notation,1586,Positional notation,"Positional notation including decimals for tenths, hundredths etc columns. Greatly simplified calculations using fractions. Downside: infinitely repeating decimals (eg. 1/3)",Simon Stevin,Netherlands,arab-numbers,Math,Technique,,
falling-motion,1589,Falling motion,Definitive proof that objects fall at same acceleration regardless of their mass. Confusions stemmed from air resistance. Also showed that force not necessary to keep object in perpetual motion. Credited with founding experimental science.,Galileo Galilei,Italy,,Natural Science,Discovery,,
cryptanalysis,1589,Code breaking,Early example of code breaking,Francois Vieta,France,arab-numbers,Math,Technique,,
stocking-frame,1589,Stocking frame,First knitting machine more efficient than by hand. Elizabeth I refused to grant a patent for fear of throwing hand knitters out of work. First example of technological unemployment.,William Lee,England,lever-math,,Invention,,
microscope,1590,Microscope,"Janssen, a spectacle maker first stacked two convex lenses to amplify the magnification.",Zachariah’s Janssen,Netherlands,eyeglass,Natural Science,Invention,,
algebraic-symbol,1591,Algebraic symbols,"Algebraic symbol system proposed, using x and y for variables",Francois Vieta,France,,Math,Technique,,
thermometer,1592,Thermometer,"First quantification of temperature. Simple device consisting of a long glass tube with markings that drew water up into it. As water warmed, it crept higher into the tube.",Galileo Galilei,Italy,glass-blowing,Natural Science,Invention,,
east-indies,1596,East indies settled,"Dutch expansion into Asia. Setup a factory at Palembang on Sumatra, starting the Dutch overseas empire",,Netherlands,ocean-navigation,Geography,Discovery,,
pi-accuracy,1596,PI accuracy,"Archimedes estimated to 3.142, but van Ceulen got it to 20 and then 35 decimal places. ",Ludolf van Ceulen,Netherlands,lever-math,Math,Discovery,,
chemistry-textbook,1597,Chemistry book,"Described preparation of hydrochloride and sulfuric and nitric acid. Still Alchemy, but set stage for real chemistry.",Andreas Libau,Germany,,Natural Science,Discovery,,
earth-magnet,1600,Magnetic earth,Discovery that Earth itself is a large magnet. Did a series of magnet-related experiments like disproving that garlic destroys magnetism and diamonds produce it. ,William Gilbert,England,magnetic-declination,Natural Science,Discovery,,
vein-valves,1603,Vein valves,"Discovery that veins have valves that prevent backflow. Galen’s doctrine was that blood was made in liver, carried to heart and pumped through arteries and veins. Fabrici found something else but didn’t dare to go against Galen",Girolamo Fabrici,Italy,,Medicine,Discovery,,
english-settlement-america,1607,English America,Jamestown became first permanent English settlement in North America,John Smith,England,america,Geography,Discovery,,
telescope,1608,Telescope,"First telescope invented. Spectacle maker accidentally found that two lenses, one at a distance from another enabled him to see really far and upside-down.",Hans Lippershey,Netherlands,,Space,Invention,,
french-settlement-america,1608,French America,"Quebec: first permanent French settlement in North America, Commissioned by Henry IV",Samuel de Champlain,France,america,Geography,Discovery,,
elliptical-planetary-orbits,1609,Elliptical orbits,"Discovery that planetary orbits aren’t circular but elliptical. Working under Tycho Brahe, Kepler found that his teacher’s data worked best for non-circular orbits with sun at one of the foci’s. Also developed Kepler’s laws.",Johannes Kepler,Germany,better-planetary-tables,Space,Discovery,,
milky-way,1609,Milky Way,"Discovery that the Milky Way is full of stars. Galileo replicated Lippershey’s telescope and peered into the Milky Way, discerning many small stars.",Galileo Galilei,Italy,telescope,Space,Discovery,,
moon-world,1609,Moon mountains,"Discovery that the moon has mountains. Also with the help of his telescope, Galileo discerned dark spots on the moon t hat might have been seas. Ultimately it suggested that the moon wasn’t just a globe of light, but a world.",Galileo Galilei,Italy,telescope,Space,Discovery,,
jupiter-moons,1610,Jupiter's four moons,Discovery that Jupiter has 4 moons orbiting it. Another point against egocentrism.,Galileo Galilei,Italy,telescope,Space,Discovery,,
venus-phases,1610,Venus phases,Discovery that Venus has a full range of phases. The discovery strongly suggests heliocentric model.,Galileo Galilei,Italy,telescope,Space,Discovery,,
sunspots,1610,Sunspots,Discovery of sunspots. Annoying to religious conservatives since the sun was supposed to be perfect.,Galileo Galilei,Italy,telescope,Space,Discovery,,
nebulas,1612,Nebulas,Discovery of nebulas (specifically Andromeda),Simon Marius,Italy,telescope,Space,Discovery,,
logarithms,1614,Logarithms,Napier first produced a table of logarithms.,John Napier,Scotland,negative-numbers,Math,Technique,,
metabolism,1614,Biological metabolism,"Beginning of the study of biological metabolism. Self-experimented while eating and drinking, found he lost more weight than the weight of his feces and urine.",Santorum Santorio,Italy,,Medicine,Discovery,,
baffin-bay,1616,Baffin Bay,"Came as far as 78 deg N, within 800 miles of North Pole, concluding that there was no practical NW passage. Furthest north for 2.5 centuries.",William Baffin,England,greenland,Geography,Discovery,,
tierra-del-fuego,1616,Tierra Del Fuego,"Sailed around the southern tip of Cape Horn, which is on a large island.",Jakob Le Maire,Netherlands,drake-strait,Geography,Discovery,,
stagecoach,1620,Stagecoaches,"A stagecoache is a horse and carriage that follows a schedule, taking passengers between destinations for payment. An early form of public transport.",,,"paved-road, cart",Transportation,Invention,,
scientific-method,1620,Scientific method,"New Organon published. Bacon laid out the foundation for the scientific method, going beyond logic. Formalized experimental science.",Francis Bacon,England,scientific-societies,Culture,Institution,,
refraction,1621,Light refraction,"Mathematical model for light refraction. Well known that when a beam of light passes from air into water, it bends towards the vertical. Snel quantified it.",Willebrord Snel,Netherlands,,Natural Science,Discovery,,
slide-rules,1622,Slide rules,"Predecessor to slide rules, which were actively used by scientists and engineers for 350 years to calculate logarithms. Only replaced by pocket calculators.",William Oughtred,England,,Math,Invention,,
gas,1624,Gas state,"Gas state of matter formulated. Greeks had four elements, and any vapor was a kind of air. Helmont suggested that like different solids and liquids, there can be different “airs”.",Jan Baptista von Helmont,Flanders,,Natural Science,Discovery,,
even-better-planetary-tables,1627,Better planetary tables,"Greatly improved by Napier’s logarithms, which was the first application of the technique.",Johannes Kepler,Germany,"elliptical-planetary-orbits, logarithms, better-planetary-tables",Space,Technique,,
aurochs-extinct,1627,Aurochs extinction,"Closest ancestor of cattle became extinct. Aurochs weren’t hunted deliberatey, just ran out of space due to domesticated cows.",,,,,Discovery,,
blood-circulation,1628,Blood circulation,"Circulatory system first understood. “Concerning motion of heart and blood” published, in which circulation is described: right ventricle => lungs => left ventricle => all over body => right ventricle",William Harvey,England,vein-valves,Medicine,Discovery,,
science-vs-religion,1633,Science religion debates,"Serious criticism of church worldview. Written in Italian (not Latin), “Dialog on the two chief world systems” was accessible to the public and created a huge stir. Copernicus-supporter was described favorably, Ptolemy-supporter laughed at. Pope forced Galileo to renounce his views.",Galileo Galilei,Italy,heliocentricity-practice,Culture,Social,,
magnetic-declination-variation,1635,Shifting magnetic declination,"Discovered that magnetic north and geographic north aren’t the same, and that magnetic north shifts position over time.",Henry Gellibrand,England,magnetic-declination,Natural Science,Discovery,,
analytic-geometry,1637,Cartesian geometry,"Represented points in 2D space as pairs of coordinates, with graphs of functions first illustrated. Algebraic and geometric solutions. Laid foundation for calculus.",Rene Descartes,France,,Math,Technique,,
fermat-last-theorem,1637,Fermat's last theorem,"Conjectured that no 3 positive integers a, b, c exist such that a^n + b^n = c^n (for n > 2). Only proven 350 years later.",Pierre de Fermat,France,,Math,Technique,,
cross-hairs,1641,Cross hairs,"First cross hairs used in the center of an optical scope. A specific spot could be located and accurately centered at the crossing point of two lines, increasing precision of telescope",William Gascoigne,England,,War,Invention,,
quinine,1642,Quinine,"Quinine as treatment for malaria in Europe. Incas used bark of cinchona tree, in which active ingredient quinine treats malaria. Allowed Europeans to remain in tropical climates.",,Incas,,Medicine,Discovery,,
adding-machine,1642,Mechanical calculators,"A series of wheels were connected in a clever way so when one rotation was made, the next wheel would turn. First patented in 1649 it was a commercial failure because it was too expensive.",Blaise Pascal,France,,Natural Science,Invention,,
south-pacific,1642,New Zealand and Tasmania,"Seeking a continent entirely in the Southern Hemisphere (predicted by Greeks), European explorers went south. Tasman discovered Indonesia, then Tasmania, then New Guinea and also South Island of New Zealand.",Abel Janszoon Tasman,Holland,,Geography,Discovery,,
barometer,1643,Barometers,"Major mining problem of the time was that water wouldn’t lift more than 33 ft. To investigate, Galileo’s assistant investigated it, and invented barometer. Cool experiment to boot. Also observed changes in atmospheric pressure over time.",Evangelista Torricelli,Italy,gas,Natural Science,Invention,,
air-pump,1645,Air pumps,"First practical air pump worked liked a water pump, but more airtight. Used to create vacuums, showed that  in a vacuum, sounds couldn’t be heard, flame can’t burn. Estimated air’s density.",Otto von Guericke,Germany,barometer,Natural Science,Invention,,
air-pressure-altitude,1648,Air pressure altitude,"Air pressure was found to depend on altitude. Pascal was too sick to go himself, so sent his brother in law up a mountain, saw mercury column descend from 30” to 27”. Showed atmosphere would have finite height of ~100 mi",Blaise Pascal,France,,Natural Science,Discovery,,
double-star,1650,Double star,First double star observed. Middle star of the Big Dipper is actually two stars very close together.,Giambattista Riccioli,Italy,telescope,Space,Discovery,,
biblical-age-of-earth,1650,Biblical earth age,"Theologians decide earth created in 4004 BC. More specifically, 9am on October 26, 4004 BC (what time zone tho?)",James Ussher,England,,Culture,Social,,
names-on-moon,1651,Moon features named,"Features of the moon first named. Published a map of the moon in “New Algamest” and named craters of the moon after famous astronomers: Tycho, Copernicus, Ptolemaeus, and Kepler.",Giambattista Riccioli,Italy,telescope,Space,Discovery,,
lymphatic-vessels,1653,Lymphatic vessels,"Veins and arteries well known, but a third type of vessel resembling veins was found. These vessels had thinner walls, carried “lymph”, or watery parts of blood. Took back interstitial fluid from outside of cells.",Olof Rudbeck,Sweden,blood-circulation,Medicine,Discovery,,
